газеты/plain/2018/04/0.txt				Жительница Воронежа выиграла билеты на чемпионат мира по футболу	04.04.2018	публицистика			Новости партнёров		нейтральный	н-возраст	н-уровень	городская	https://moe-online.ru/news/society/1010000	МОЁ! Online		2018	газета	Россия	Воронежская область	ru
газеты/plain/2018/04/1.txt				Спасатели предупредили липчан о смертельной опасности выхода на лёд	03.04.2018	публицистика			Погода		нейтральный	н-возраст	н-уровень	городская	https://moe-online.ru/news/society/1010010	МОЁ! Online		2018	газета	Россия	Воронежская область	ru
газеты/plain/2018/04/2.txt				В Коминтерновском районе Воронежа под новостройки снесут 38 домов	03.04.2018	публицистика			Город		нейтральный	н-возраст	н-уровень	городская	https://moe-online.ru/news/society/1010020	МОЁ! Online		2018	газета	Россия	Воронежская область	ru
газеты/plain/2018/04/3.txt				Роспотребнадзор дал советы по выбору куличей и яиц к Пасхе	04.04.2018	публицистика			Общество		нейтральный	н-возраст	н-уровень	городская	https://moe-online.ru/news/society/1010030	МОЁ! Online		2018	газета	Россия	Воронежская область	ru
газеты/plain/2018/04/4.txt				На бетонном заводе в Липецке погиб рабочий	04.04.2018	публицистика			Происшествия		нейтральный	н-возраст	н-уровень	городская	https://moe-online.ru/news/society/1010040	МОЁ! Online		2018	газета	Россия	Воронежская область	ru
газеты/plain/2018/04/5.txt				В Воронежской области «Шкода» вылетела в кювет: один погибший, двое пострадавших	04.04.2018	публицистика			Общество		нейтральный	н-возраст	н-уровень	городская	https://moe-online.ru/news/society/1010050	МОЁ! Online		2018	газета	Россия	Воронежская область	ru
